{"schema_version":"0.1","project":{"name":"New Gold Project","type":"python"},"standard":{"name":"Ideias Standard","version":"0.1.0-draft","profile":"LIGHT"},"packs":["python"],"governance":{"product_authority":"USER","builder":"HUMAN_OR_AGENT","auditor":"INDEPENDENT_REVIEWER"},"context":{"strategy":"PROGRESSIVE","full_repo_scan_default":false}}
